name,pref,address,companies,lines,exclude
磐田,静岡県,磐田市中泉,JR東海,JR東海道本線(熱海～浜松),静岡県
豊田町,静岡県,磐田市立野,JR東海,JR東海道本線(熱海～浜松),静岡県
天竜川,静岡県,浜松市東区天龍川町,JR東海,JR東海道本線(熱海～浜松),静岡県
浜松,静岡県,浜松市中区砂山町,JR東海・遠州鉄道,JR東海道本線(熱海～浜松)・JR東海道本線(浜松～岐阜)・遠州鉄道鉄道線,静岡県
高塚,静岡県,浜松市南区高塚町,JR東海,JR東海道本線(浜松～岐阜),静岡県
舞阪,静岡県,浜松市西区馬郡町,JR東海,JR東海道本線(浜松～岐阜),静岡県
弁天島,静岡県,浜松市西区舞阪町弁天島,JR東海,JR東海道本線(浜松～岐阜),静岡県
新居町,静岡県,静岡県湖西市新居町新居,JR東海,JR東海道本線(浜松～岐阜),静岡県
鷲津,静岡県,湖西市鷲津,JR東海,JR東海道本線(浜松～岐阜),静岡県
新所原,静岡県,湖西市新所原３丁目,JR東海・天竜浜名湖鉄道,JR東海道本線(浜松～岐阜)・天竜浜名湖線,静岡県
二川,愛知県,豊橋市大岩町南元屋敷,JR東海,JR東海道本線(浜松～岐阜),愛知県
西小坂井,愛知県,愛知県豊川市伊奈町前山20,JR東海,JR東海道本線(浜松～岐阜),愛知県
愛知御津,愛知県,豊川市御津町西方字松本,JR東海,JR東海道本線(浜松～岐阜),愛知県
三河大塚,愛知県,蒲郡市大塚町笹子,JR東海,JR東海道本線(浜松～岐阜),愛知県
三河三谷,愛知県,蒲郡市三谷町上野,JR東海,JR東海道本線(浜松～岐阜),愛知県
蒲郡,愛知県,蒲郡市元町,JR東海・名古屋鉄道,JR東海道本線(浜松～岐阜)・名鉄蒲郡線,愛知県
三河塩津,愛知県,蒲郡市竹谷町油井,JR東海・名古屋鉄道,JR東海道本線(浜松～岐阜)・名鉄蒲郡線,愛知県
三ケ根,愛知県,愛知県額田郡幸田町大字深溝字大池田12-1,JR東海,JR東海道本線(浜松～岐阜),愛知県
幸田,愛知県,額田郡幸田町芦谷字幸田,JR東海,JR東海道本線(浜松～岐阜),愛知県
相見,愛知県,愛知県額田郡幸田町大字菱池字カマ46,JR東海,JR東海道本線(浜松～岐阜),愛知県
岡崎,愛知県,岡崎市羽根町東荒子,JR東海・愛知環状鉄道,JR東海道本線(浜松～岐阜)・愛知環状鉄道線,愛知県
西岡崎,愛知県,岡崎市昭和町北浦,JR東海,JR東海道本線(浜松～岐阜),愛知県
安城,愛知県,安城市御幸本町,JR東海,JR東海道本線(浜松～岐阜),愛知県
三河安城,愛知県,安城市二本木町二ツ池,JR東海,JR東海道本線(浜松～岐阜),愛知県
東刈谷,愛知県,刈谷市東刈谷町１丁目,JR東海,JR東海道本線(浜松～岐阜),愛知県
野田新町,愛知県,刈谷市野田新町,JR東海,JR東海道本線(浜松～岐阜),愛知県
刈谷,愛知県,刈谷市桜町１丁目,JR東海・名古屋鉄道,JR東海道本線(浜松～岐阜)・名鉄三河線,愛知県
逢妻,愛知県,刈谷市熊野町２丁目,JR東海,JR東海道本線(浜松～岐阜),愛知県
大府,愛知県,大府市中央町３丁目,JR東海,JR東海道本線(浜松～岐阜)・JR武豊線,愛知県
共和,愛知県,大府市共栄町９丁目,JR東海,JR東海道本線(浜松～岐阜),愛知県
南大高,愛知県,名古屋市緑区大高町字池之内4-10,JR東海,JR東海道本線(浜松～岐阜),愛知県
大高,愛知県,名古屋市緑区大高町鶴田,JR東海,JR東海道本線(浜松～岐阜),愛知県
笠寺,愛知県,名古屋市南区立脇町２丁目,JR東海,JR東海道本線(浜松～岐阜),愛知県
熱田,愛知県,名古屋市熱田区森後町２丁目,JR東海,JR東海道本線(浜松～岐阜),愛知県
尾頭橋,愛知県,名古屋市中川区尾頭橋４,JR東海,JR東海道本線(浜松～岐阜),愛知県
枇杷島,愛知県,清須市西枇杷島町旭１丁目,JR東海・東海交通事業,JR東海道本線(浜松～岐阜)・東海交通事業城北線,愛知県
清洲,愛知県,稲沢市北市場町,JR東海,JR東海道本線(浜松～岐阜),愛知県
稲沢,愛知県,稲沢市駅前１丁目,JR東海,JR東海道本線(浜松～岐阜),愛知県
尾張一宮,愛知県,一宮市栄３丁目,JR東海・名古屋鉄道,JR東海道本線(浜松～岐阜)・名鉄名古屋本線・名鉄尾西線,愛知県
木曽川,愛知県,一宮市木曽川町黒田,JR東海,JR東海道本線(浜松～岐阜),愛知県
西岐阜,岐阜県,岐阜市市橋３丁目,JR東海,JR東海道本線(岐阜～美濃赤坂・米原),岐阜県
穂積,岐阜県,瑞穂市別府,JR東海,JR東海道本線(岐阜～美濃赤坂・米原),岐阜県
大垣,岐阜県,大垣市高屋町１丁目,JR東海・樽見鉄道・養老鉄道,JR東海道本線(岐阜～美濃赤坂・米原)・樽見鉄道樽見線・養老鉄道養老線,岐阜県
荒尾,岐阜県,大垣市荒尾町,JR東海,JR東海道本線(岐阜～美濃赤坂・米原),岐阜県|熊本県
美濃赤坂,岐阜県,大垣市赤坂町,JR東海,JR東海道本線(岐阜～美濃赤坂・米原),岐阜県
垂井,岐阜県,不破郡垂井町東町,JR東海,JR東海道本線(岐阜～美濃赤坂・米原),岐阜県
関ケ原,岐阜県,岐阜県不破郡関ケ原町関ヶ原,JR東海,JR東海道本線(岐阜～美濃赤坂・米原),岐阜県
柏原,滋賀県,米原市柏原,JR東海,JR東海道本線(岐阜～美濃赤坂・米原),兵庫県|大阪府|滋賀県
近江長岡,滋賀県,米原市長岡,JR東海,JR東海道本線(岐阜～美濃赤坂・米原),滋賀県
醒ケ井,滋賀県,滋賀県米原市醒井619,JR東海,JR東海道本線(岐阜～美濃赤坂・米原),滋賀県
来宮,静岡県,熱海市福道町,JR東日本,JR伊東線,静岡県
伊豆多賀,静岡県,熱海市上多賀,JR東日本,JR伊東線,静岡県
網代,静岡県,熱海市下多賀,JR東日本,JR伊東線,静岡県
宇佐美,静岡県,伊東市宇佐美,JR東日本,JR伊東線,静岡県
伊東,静岡県,伊東市湯川３丁目,JR東日本・伊豆急行,JR伊東線・伊豆急行線,静岡県
下曽我,神奈川県,小田原市曽我原,JR東海,JR御殿場線,神奈川県
上大井,神奈川県,足柄上郡大井町上大井,JR東海,JR御殿場線,神奈川県
相模金子,神奈川県,足柄上郡大井町金子,JR東海,JR御殿場線,神奈川県
松田,神奈川県,足柄上郡松田町松田惣領,JR東海,JR御殿場線,神奈川県
東山北,神奈川県,足柄上郡山北町向原,JR東海,JR御殿場線,神奈川県
山北,神奈川県,足柄上郡山北町山北,JR東海,JR御殿場線,神奈川県
谷峨,神奈川県,足柄上郡山北町谷ケ,JR東海,JR御殿場線,神奈川県
駿河小山,静岡県,駿東郡小山町小山,JR東海,JR御殿場線,静岡県
足柄,静岡県,駿東郡小山町竹之下,JR東海,JR御殿場線,神奈川県|静岡県
御殿場,静岡県,御殿場市新橋,JR東海,JR御殿場線,静岡県
南御殿場,静岡県,御殿場市竈,JR東海,JR御殿場線,静岡県
富士岡,静岡県,御殿場市中山,JR東海,JR御殿場線,静岡県
岩波,静岡県,裾野市岩波,JR東海,JR御殿場線,静岡県
裾野,静岡県,裾野市平松,JR東海,JR御殿場線,静岡県
長泉なめり,静岡県,駿東郡長泉町納米里５８-６,JR東海,JR御殿場線,静岡県
下土狩,静岡県,駿東郡長泉町下土狩,JR東海,JR御殿場線,静岡県
大岡,静岡県,沼津市大岡,JR東海,JR御殿場線,静岡県
尾張森岡,愛知県,知多郡東浦町森岡字前田,JR東海,JR武豊線,愛知県
緒川,愛知県,知多郡東浦町緒川字竹塚,JR東海,JR武豊線,愛知県
石浜,愛知県,知多郡東浦町石浜字中子新田,JR東海,JR武豊線,愛知県
東浦,愛知県,知多郡東浦町藤江字抑牛,JR東海,JR武豊線,愛知県
亀崎,愛知県,半田市亀崎常盤町２丁目,JR東海,JR武豊線,愛知県
乙川,愛知県,半田市乙川町,JR東海,JR武豊線,愛知県
半田,愛知県,半田市御幸町,JR東海,JR武豊線,愛知県
東成岩,愛知県,半田市旭町３丁目,JR東海,JR武豊線,愛知県
武豊,愛知県,知多郡武豊町金下,JR東海,JR武豊線,愛知県
小泉,岐阜県,多治見市小泉町１丁目,JR東海,JR太多線,岐阜県
根本,岐阜県,多治見市根本町２丁目,JR東海,JR太多線,岐阜県
姫,岐阜県,多治見市姫町１丁目,JR東海,JR太多線,岐阜県
下切,岐阜県,可児市下切字青木,JR東海,JR太多線,岐阜県
可児,岐阜県,可児市下恵土,JR東海・名古屋鉄道,JR太多線・名鉄広見線,岐阜県
美濃川合,岐阜県,美濃加茂市川合町,JR東海,JR太多線,岐阜県
八田,愛知県,名古屋市中川区八田町字下長田,JR東海・近畿日本鉄道・名古屋市交通局,JR関西本線(名古屋～亀山)・近鉄名古屋線・名古屋市営地下鉄東山線,愛知県
春田,愛知県,名古屋市中川区春田２-９２-２,JR東海,JR関西本線(名古屋～亀山),愛知県
蟹江,愛知県,海部郡蟹江町大字今上六反田,JR東海,JR関西本線(名古屋～亀山),愛知県
永和,愛知県,愛西市大野町,JR東海,JR関西本線(名古屋～亀山),愛知県
弥富,愛知県,弥富市鯏浦町中六,JR東海・名古屋鉄道・近畿日本鉄道,JR関西本線(名古屋～亀山)・名鉄尾西線・近鉄名古屋線,愛知県
長島,三重県,桑名市長島町西外面,JR東海・近畿日本鉄道,JR関西本線(名古屋～亀山)・近鉄名古屋線,三重県
桑名,三重県,桑名市東方,JR東海・近畿日本鉄道・三岐鉄道,JR関西本線(名古屋～亀山)・近鉄名古屋線・三岐鉄道北勢線・養老鉄道養老線,三重県
朝日,三重県,三重郡朝日町柿,JR東海,JR関西本線(名古屋～亀山),三重県
富田,三重県,四日市市富田３,JR東海,JR関西本線(名古屋～亀山),三重県|大阪府|栃木県
富田浜,三重県,四日市市東茂福町,JR東海,JR関西本線(名古屋～亀山),三重県
四日市,三重県,四日市市本町,JR東海,JR関西本線(名古屋～亀山),三重県
南四日市,三重県,四日市市日永東３,JR東海,JR関西本線(名古屋～亀山),三重県
河原田,三重県,四日市市河原田町,JR東海・伊勢鉄道,JR関西本線(名古屋～亀山)・伊勢鉄道伊勢線,三重県
河曲,三重県,鈴鹿市木田町,JR東海,JR関西本線(名古屋～亀山),三重県
加佐登,三重県,鈴鹿市加佐登町,JR東海,JR関西本線(名古屋～亀山),三重県
井田川,三重県,亀山市井田川町,JR東海,JR関西本線(名古屋～亀山),三重県
亀山,三重県,亀山市御幸町,JR東海・JR西日本,JR関西本線(名古屋～亀山)・JR関西本線(亀山～加茂)・JR紀勢本線,三重県|兵庫県
関,三重県,亀山市関町新所,JR西日本,JR関西本線(亀山～加茂),三重県|岐阜県
加太,三重県,亀山市加太市場,JR西日本,JR関西本線(亀山～加茂),三重県|和歌山県
柘植,三重県,伊賀市柘植町小林,JR西日本,JR関西本線(亀山～加茂)・JR草津線,三重県
新堂,三重県,伊賀市新堂中出,JR西日本,JR関西本線(亀山～加茂),三重県
佐那具,三重県,伊賀市外山,JR西日本,JR関西本線(亀山～加茂),三重県
伊賀上野,三重県,伊賀市三田,JR西日本・伊賀鉄道,JR関西本線(亀山～加茂)・伊賀鉄道伊賀線,三重県
島ケ原,三重県,三重県伊賀市島ヶ原広垣内5770,JR西日本,JR関西本線(亀山～加茂),三重県
月ケ瀬口,京都府,京都府相楽郡南山城村大字北大河原小字殿田平尾53-3,JR西日本,JR関西本線(亀山～加茂),京都府
大河原,京都府,相楽郡南山城村大字北大河原,JR西日本,JR関西本線(亀山～加茂),京都府|宮城県
笠置,京都府,相楽郡笠置町笠置,JR西日本,JR関西本線(亀山～加茂),京都府
加茂,京都府,木津川市加茂町里,JR西日本,JR関西本線(亀山～加茂)・大和路線,三重県|京都府|新潟県
下庄,三重県,亀山市下庄町,JR東海,JR紀勢本線,三重県
一身田,三重県,津市大里窪田町,JR東海,JR紀勢本線,三重県
津,三重県,津市羽所町,JR東海・近畿日本鉄道・伊勢鉄道,JR紀勢本線・近鉄名古屋線・伊勢鉄道伊勢線,三重県
阿漕,三重県,津市岩田字大倉,JR東海,JR紀勢本線,三重県
高茶屋,三重県,津市高茶屋小森町,JR東海,JR紀勢本線,三重県
六軒,三重県,松阪市小津町,JR東海,JR紀勢本線,三重県|岐阜県
松阪,三重県,松阪市京町,JR東海・近畿日本鉄道,JR紀勢本線・JR名松線・近鉄山田線,三重県
徳和,三重県,松阪市下村町,JR東海,JR紀勢本線,三重県
多気,三重県,多気郡多気町多気,JR東海,JR紀勢本線・JR参宮線,三重県
相可,三重県,多気郡多気町大字相可,JR東海,JR紀勢本線,三重県
佐奈,三重県,多気郡多気町大字平谷,JR東海,JR紀勢本線,三重県
栃原,三重県,多気郡大台町大字栃原,JR東海,JR紀勢本線,三重県
川添,三重県,多気郡大台町大字上楠,JR東海,JR紀勢本線,三重県
三瀬谷,三重県,多気郡大台町佐原,JR東海,JR紀勢本線,三重県
滝原,三重県,多気郡大台町大ケ所,JR東海,JR紀勢本線,三重県
阿曽,三重県,度会郡大紀町阿曽,JR東海,JR紀勢本線,三重県
伊勢柏崎,三重県,度会郡大紀町崎,JR東海,JR紀勢本線,三重県
大内山,三重県,度会郡大紀町大内山,JR東海,JR紀勢本線,三重県
梅ケ谷,三重県,三重県度会郡大紀町大内山1135,JR東海,JR紀勢本線,三重県
紀伊長島,三重県,北牟婁郡紀北町紀伊長島区東長島,JR東海,JR紀勢本線,三重県
三野瀬,三重県,北牟婁郡紀北町紀伊長島区三浦,JR東海,JR紀勢本線,三重県
船津,三重県,三重県北牟婁郡紀北町海山区上里456,JR東海,JR紀勢本線,三重県
相賀,三重県,北牟婁郡紀北町海山区相賀,JR東海,JR紀勢本線,三重県
尾鷲,三重県,尾鷲市中村町,JR東海,JR紀勢本線,三重県
大曽根浦,三重県,尾鷲市大字大曽根浦,JR東海,JR紀勢本線,三重県
九鬼,三重県,尾鷲市九鬼町,JR東海,JR紀勢本線,三重県
三木里,三重県,尾鷲市三木里町,JR東海,JR紀勢本線,三重県
賀田,三重県,尾鷲市曽根町,JR東海,JR紀勢本線,三重県
二木島,三重県,熊野市二木島町,JR東海,JR紀勢本線,三重県
新鹿,三重県,熊野市新鹿町,JR東海,JR紀勢本線,三重県
波田須,三重県,熊野市波田須町,JR東海,JR紀勢本線,三重県
大泊,三重県,熊野市大泊町,JR東海,JR紀勢本線,三重県
熊野市,三重県,熊野市井戸町,JR東海,JR紀勢本線,三重県
有井,三重県,熊野市有馬町,JR東海,JR紀勢本線,三重県
神志山,三重県,南牟婁郡御浜町大字下市木,JR東海,JR紀勢本線,三重県
紀伊市木,三重県,南牟婁郡御浜町大字下市木,JR東海,JR紀勢本線,三重県
阿田和,三重県,南牟婁郡御浜町大字阿田和,JR東海,JR紀勢本線,三重県
紀伊井田,三重県,南牟婁郡紀宝町井田,JR東海,JR紀勢本線,三重県
鵜殿,三重県,南牟婁郡紀宝町鵜殿,JR東海,JR紀勢本線,三重県
新宮,和歌山県,新宮市新宮,JR東海・JR西日本,JR紀勢本線・きのくに線,和歌山県
油日,滋賀県,甲賀市甲賀町上野,JR西日本,JR草津線,滋賀県
甲賀,滋賀県,甲賀市甲賀町大原市場,JR西日本,JR草津線,滋賀県
寺庄,滋賀県,甲賀市甲南町寺庄,JR西日本,JR草津線,滋賀県
甲南,滋賀県,甲賀市甲南町深川,JR西日本,JR草津線,滋賀県
貴生川,滋賀県,甲賀市水口町虫生野,JR西日本・近江鉄道・信楽高原鐵道,JR草津線・近江鉄道本線・信楽高原鐵道信楽線,滋賀県
三雲,滋賀県,湖南市三雲,JR西日本,JR草津線,滋賀県
甲西,滋賀県,湖南市平松堂前,JR西日本,JR草津線,滋賀県
石部,滋賀県,湖南市石部,JR西日本,JR草津線,滋賀県
手原,滋賀県,栗東市大字手原,JR西日本,JR草津線,滋賀県
草津,滋賀県,草津市渋川１丁目,JR西日本,JR草津線・琵琶湖線,広島県|滋賀県
外城田,三重県,多気郡多気町大字土羽,JR東海,JR参宮線,三重県
田丸,三重県,度会郡玉城町佐田,JR東海,JR参宮線,三重県
宮川,三重県,伊勢市小俣町本町２９３１-１,JR東海,JR参宮線,三重県
山田上口,三重県,伊勢市常磐町,JR東海,JR参宮線,三重県
伊勢市,三重県,伊勢市吹上１丁目,JR東海・近畿日本鉄道,JR参宮線・近鉄山田線,三重県
五十鈴ケ丘,三重県,三重県伊勢市黒瀬町1342,JR東海,JR参宮線,三重県
二見浦,三重県,伊勢市二見町三津,JR東海,JR参宮線,三重県
松下,三重県,伊勢市二見町松下,JR東海,JR参宮線,三重県
鳥羽,三重県,鳥羽市鳥羽１,JR東海・近畿日本鉄道,JR参宮線・近鉄鳥羽線・近鉄志摩線,三重県
上ノ庄,三重県,松阪市上ノ庄町,JR東海,JR名松線,三重県
権現前,三重県,松阪市嬉野権現前町,JR東海,JR名松線,三重県
伊勢八太,三重県,津市一志町小山（その他）,JR東海,JR名松線,三重県
一志,三重県,津市一志町八太（その他）,JR東海・近畿日本鉄道,JR名松線・近鉄大阪線,三重県
井関,三重県,津市一志町井関,JR東海,JR名松線,三重県
伊勢大井,三重県,津市一志町井生,JR東海,JR名松線,三重県
伊勢川口,三重県,津市白山町川口,JR東海,JR名松線,三重県
関ノ宮,三重県,津市白山町川口,JR東海,JR名松線,三重県
家城,三重県,津市白山町南家城,JR東海,JR名松線,三重県
伊勢竹原,三重県,津市美杉町竹原,JR東海,JR名松線,三重県
伊勢鎌倉,三重県,津市美杉町八知,JR東海,JR名松線,三重県
伊勢八知,三重県,津市美杉町八知,JR東海,JR名松線,三重県
比津,三重県,津市美杉町八知,JR東海,JR名松線,三重県
伊勢奥津,三重県,津市美杉町奥津,JR東海,JR名松線,三重県
彦根,滋賀県,彦根市古沢町,JR西日本・近江鉄道,琵琶湖線・近江鉄道本線,滋賀県
南彦根,滋賀県,彦根市小泉町,JR西日本,琵琶湖線,滋賀県
河瀬,滋賀県,彦根市南川瀬町,JR西日本,琵琶湖線,滋賀県
稲枝,滋賀県,彦根市稲枝町,JR西日本,琵琶湖線,滋賀県
能登川,滋賀県,東近江市林町,JR西日本,琵琶湖線,滋賀県
安土,滋賀県,滋賀県近江八幡市安土町上豊浦,JR西日本,琵琶湖線,滋賀県
近江八幡,滋賀県,近江八幡市鷹飼町,JR西日本・近江鉄道,琵琶湖線・近江鉄道八日市線,滋賀県
篠原,滋賀県,近江八幡市上野町,JR西日本,琵琶湖線,愛知県|滋賀県|高知県
野洲,滋賀県,野洲市小篠原,JR西日本,琵琶湖線,滋賀県
守山,滋賀県,守山市梅田町,JR西日本,琵琶湖線,滋賀県
栗東,滋賀県,栗東市綣字新改,JR西日本,琵琶湖線,滋賀県
南草津,滋賀県,草津市野路町池之尻,JR西日本,琵琶湖線,滋賀県
瀬田,滋賀県,大津市大萱１丁目,JR西日本,琵琶湖線,滋賀県|熊本県
石山,滋賀県,大津市粟津町,JR西日本・京阪電鉄,琵琶湖線・京阪石山坂本線,滋賀県
膳所,滋賀県,大津市馬場２丁目,JR西日本・京阪電鉄,琵琶湖線・京阪石山坂本線,滋賀県
大津,滋賀県,大津市春日町,JR西日本,琵琶湖線,滋賀県
山科,京都府,京都市山科区安朱北屋敷町,JR西日本・京阪電鉄・京都市交通局,琵琶湖線・JR湖西線・京阪京津線・京都市営地下鉄東西線,京都府
西大路,京都府,京都市南区唐橋平垣町,JR西日本,JR京都線,京都府
桂川,京都府,京都市南区久世高田町6-7,JR西日本,JR京都線,京都府|福岡県
向日町,京都府,向日市寺戸町久々相,JR西日本,JR京都線,京都府
長岡京,京都府,長岡京市神足２丁目,JR西日本,JR京都線,京都府
山崎,京都府,乙訓郡大山崎町西谷,JR西日本・阪急電鉄,JR京都線・阪急京都本線,京都府|北海道|愛知県
島本,大阪府,三島郡島本町桜井２丁目,JR西日本,JR京都線,大阪府
高槻,大阪府,高槻市白梅町,JR西日本,JR京都線,大阪府
摂津富田,大阪府,高槻市富田町１丁目,JR西日本,JR京都線,大阪府
JR総持寺,大阪府,大阪府茨木市庄一丁目28番55号,JR西日本,JR京都線,大阪府
茨木,大阪府,茨木市駅前１丁目,JR西日本,JR京都線,大阪府
千里丘,大阪府,摂津市千里丘１丁目,JR西日本,JR京都線,大阪府
岸辺,大阪府,吹田市岸部南１丁目,JR西日本,JR京都線,大阪府
吹田,大阪府,大阪府吹田市朝日町1-1,JR西日本,JR京都線,大阪府
東淀川,大阪府,大阪市淀川区宮原２丁目,JR西日本,JR京都線,大阪府
新大阪,大阪府,大阪市淀川区西中島５丁目,JR西日本・Osaka Metro,JR京都線・JR宝塚線・おおさか東線・大阪メトロ御堂筋線,大阪府
塚本,大阪府,大阪市淀川区塚本２丁目,JR西日本,JR神戸線(大阪～神戸),大阪府
尼崎,兵庫県,兵庫県尼崎市潮江一丁目1-1,JR西日本,JR神戸線(大阪～神戸)・JR東西線・JR宝塚線,兵庫県
立花,兵庫県,尼崎市立花町１丁目,JR西日本,JR神戸線(大阪～神戸),兵庫県
甲子園口,兵庫県,西宮市甲子園口２丁目,JR西日本,JR神戸線(大阪～神戸),兵庫県
西宮,兵庫県,兵庫県西宮市池田町9-3,JR西日本,JR神戸線(大阪～神戸),兵庫県
さくら夙川,兵庫県,西宮市安井２７９８番地,JR西日本,JR神戸線(大阪～神戸),兵庫県
芦屋,兵庫県,兵庫県芦屋市船戸町1-30,JR西日本,JR神戸線(大阪～神戸),兵庫県
甲南山手,兵庫県,神戸市東灘区森北町,JR西日本,JR神戸線(大阪～神戸),兵庫県
摂津本山,兵庫県,神戸市東灘区岡本１丁目,JR西日本,JR神戸線(大阪～神戸),兵庫県
住吉,兵庫県,神戸市東灘区住吉本町一丁目2-9,JR西日本・神戸新交通,JR神戸線(大阪～神戸)・六甲ライナー,兵庫県|大阪府|東京都|熊本県|長崎県
六甲道,兵庫県,神戸市灘区永手町４丁目,JR西日本,JR神戸線(大阪～神戸),兵庫県
摩耶,兵庫県,神戸市灘区灘南通六丁目,JR西日本,JR神戸線(大阪～神戸),兵庫県
灘,兵庫県,神戸市灘区岩屋北町７丁目,JR西日本,JR神戸線(大阪～神戸),兵庫県
三ノ宮,兵庫県,神戸市中央区布引町,JR西日本・阪急電鉄・阪神電鉄,JR神戸線(大阪～神戸)・阪急神戸本線・阪神本線・神戸高速東西線・神戸市営地下鉄山手線 ほか,兵庫県
元町,兵庫県,神戸市中央区元町高架通り,JR西日本・阪神電鉄・神戸高速鉄道,JR神戸線(大阪～神戸)・阪神本線・神戸高速東西線,兵庫県|北海道
神戸,兵庫県,神戸市中央区相生町３丁目,JR西日本・神戸市交通局,JR神戸線(大阪～神戸)・JR神戸線(神戸～姫路)・夢かもめ,兵庫県|愛知県|群馬県
大津京,滋賀県,大津市皇子が丘２丁目,JR西日本・京阪電鉄,JR湖西線・京阪石山坂本線,滋賀県
唐崎,滋賀県,大津市唐崎２丁目,JR西日本,JR湖西線,滋賀県
比叡山坂本,滋賀県,大津市坂本本町,JR西日本,JR湖西線,滋賀県
おごと温泉,滋賀県,大津市雄琴３丁目,JR西日本,JR湖西線,滋賀県
堅田,滋賀県,大津市真野町,JR西日本,JR湖西線,滋賀県
小野,滋賀県,大津市湖青１丁目,JR西日本,JR湖西線,京都府|兵庫県|滋賀県|長崎県|長野県
和邇,滋賀県,大津市和邇中浜,JR西日本,JR湖西線,滋賀県
蓬莱,滋賀県,大津市八屋戸,JR西日本,JR湖西線,滋賀県
志賀,滋賀県,大津市木戸,JR西日本,JR湖西線,滋賀県
比良,滋賀県,大津市北比良,JR西日本,JR湖西線,愛知県|滋賀県
近江舞子,滋賀県,大津市南小松,JR西日本,JR湖西線,滋賀県
北小松,滋賀県,大津市北小松,JR西日本,JR湖西線,滋賀県
近江高島,滋賀県,高島市勝野,JR西日本,JR湖西線,滋賀県
安曇川,滋賀県,高島市安曇川町西万木,JR西日本,JR湖西線,滋賀県
新旭,滋賀県,高島市新旭町旭,JR西日本,JR湖西線,滋賀県
近江今津,滋賀県,高島市今津町名小路,JR西日本,JR湖西線,滋賀県
近江中庄,滋賀県,高島市マキノ町中庄,JR西日本,JR湖西線,滋賀県
マキノ,滋賀県,高島市マキノ町西浜,JR西日本,JR湖西線,滋賀県
永原,滋賀県,滋賀県長浜市西浅井町大浦字羽部1098-4,JR西日本,JR湖西線,滋賀県
木津,京都府,木津川市木津,JR西日本,大和路線・学研都市線・奈良線,京都府|兵庫県
平城山,奈良県,奈良市佐保台１丁目,JR西日本,大和路線・奈良線,奈良県
郡山,奈良県,大和郡山市高田口町,JR西日本,大和路線,奈良県|福島県
大和小泉,奈良県,大和郡山市小泉町,JR西日本,大和路線,奈良県
法隆寺,奈良県,生駒郡斑鳩町興留,JR西日本,大和路線,奈良県
王寺,奈良県,北葛城郡王寺町久度２丁目,JR西日本・近畿日本鉄道,大和路線・JR和歌山線・近鉄生駒線・近鉄田原本線,奈良県
三郷,奈良県,生駒郡三郷町大字立野南２,JR西日本,大和路線,埼玉県|奈良県|愛知県
河内堅上,大阪府,柏原市大字青谷,JR西日本,大和路線,大阪府
