name,pref,address,companies,lines,exclude
前原,千葉県,船橋市前原西７-１７-２１,新京成電鉄,新京成線,千葉県
薬園台,千葉県,船橋市薬円台６-１-１,新京成電鉄,新京成線,千葉県
習志野,千葉県,船橋市習志野台４-１-９,新京成電鉄,新京成線,千葉県
北習志野,千葉県,船橋市習志野台３-１-１,新京成電鉄・東葉高速鉄道,新京成線・東葉高速線,千葉県
高根木戸,千葉県,船橋市習志野台１-１-３,新京成電鉄,新京成線,千葉県
高根公団,千葉県,船橋市高根台１-６-１,新京成電鉄,新京成線,千葉県
滝不動,千葉県,船橋市南三咲３-２３-１,新京成電鉄,新京成線,千葉県
三咲,千葉県,船橋市南三咲２-２-１,新京成電鉄,新京成線,千葉県
二和向台,千葉県,船橋市二和東５-３８-１,新京成電鉄,新京成線,千葉県
鎌ヶ谷大仏,千葉県,千葉県鎌ケ谷市鎌ケ谷1丁目8番1号,新京成電鉄,新京成線,千葉県
初富,千葉県,鎌ケ谷市中央１-２-１９,新京成電鉄,新京成線,千葉県
北初富,千葉県,鎌ケ谷市北中沢１-１８-２５,新京成電鉄,新京成線,千葉県
くぬぎ山,千葉県,鎌ケ谷市くぬぎ山５-１-６,新京成電鉄,新京成線,千葉県
元山,千葉県,松戸市五香南１-５-１,新京成電鉄,新京成線,千葉県|香川県
五香,千葉県,松戸市金ケ作４０８-８,新京成電鉄,新京成線,千葉県
常盤平,千葉県,松戸市常盤平１-２９,新京成電鉄,新京成線,千葉県
みのり台,千葉県,松戸市松戸新田５７５-１９,新京成電鉄,新京成線,千葉県
松戸新田,千葉県,松戸市松戸新田２６４-２,新京成電鉄,新京成線,千葉県
上本郷,千葉県,松戸市上本郷２６４８-１１,新京成電鉄,新京成線,千葉県
下館二高前,茨城県,筑西市岡芹,真岡鐵道,真岡鐵道真岡線,茨城県
折本,茨城県,筑西市折本,真岡鐵道,真岡鐵道真岡線,茨城県
ひぐち,茨城県,筑西市折本,真岡鐵道,真岡鐵道真岡線,茨城県
久下田,栃木県,栃木県真岡市久下田,真岡鐵道,真岡鐵道真岡線,栃木県
寺内,栃木県,真岡市寺内,真岡鐵道,真岡鐵道真岡線,栃木県
真岡,栃木県,真岡市台町,真岡鐵道,真岡鐵道真岡線,栃木県
北真岡,栃木県,真岡市熊倉町,真岡鐵道,真岡鐵道真岡線,栃木県
西田井,栃木県,真岡市西田井,真岡鐵道,真岡鐵道真岡線,栃木県
北山,栃木県,真岡市西田井,真岡鐵道,真岡鐵道真岡線,京都府|宮城県|栃木県|高知県
益子,栃木県,芳賀郡益子町益子,真岡鐵道,真岡鐵道真岡線,栃木県
七井,栃木県,芳賀郡益子町大沢,真岡鐵道,真岡鐵道真岡線,栃木県
多田羅,栃木県,芳賀郡市貝町多田羅,真岡鐵道,真岡鐵道真岡線,栃木県
市塙,栃木県,芳賀郡市貝町市塙,真岡鐵道,真岡鐵道真岡線,栃木県
笹原田,栃木県,芳賀郡市貝町笹原田,真岡鐵道,真岡鐵道真岡線,栃木県
天矢場,栃木県,芳賀郡茂木町北高岡,真岡鐵道,真岡鐵道真岡線,栃木県
茂木,栃木県,芳賀郡茂木町茂木,真岡鐵道,真岡鐵道真岡線,栃木県
市役所前,千葉県,千葉市中央区千葉港地先道路,千葉都市モノレール,千葉都市モノレール１号線,北海道|千葉県|和歌山県|広島県|愛媛県|愛知県|長野県|鹿児島県
栄町,千葉県,千葉市中央区栄町２９-９,千葉都市モノレール,千葉都市モノレール１号線,北海道|千葉県|富山県|愛知県|東京都
葭川公園,千葉県,千葉市中央区中央２-１,千葉都市モノレール,千葉都市モノレール１号線,千葉県
県庁前,千葉県,千葉市中央区市場町１-２,千葉都市モノレール,千葉都市モノレール１号線,兵庫県|千葉県|富山県|広島県|愛媛県|沖縄県|高知県
千葉公園,千葉県,千葉市中央区弁天３-４６４,千葉都市モノレール,千葉都市モノレール２号線,千葉県
作草部,千葉県,千葉市稲毛区作草部２-１-１９,千葉都市モノレール,千葉都市モノレール２号線,千葉県
天台,千葉県,千葉市稲毛区天台１-１０９５-２,千葉都市モノレール,千葉都市モノレール２号線,千葉県
穴川,千葉県,千葉市稲毛区穴川７９-１,千葉都市モノレール,千葉都市モノレール２号線,三重県|千葉県
スポーツセンター,千葉県,千葉市稲毛区天台６-２１２-６,千葉都市モノレール,千葉都市モノレール２号線,千葉県
動物公園,千葉県,千葉市若葉区源町４０７-７,千葉都市モノレール,千葉都市モノレール２号線,千葉県
みつわ台,千葉県,千葉市若葉区みつわ台３-２８,千葉都市モノレール,千葉都市モノレール２号線,千葉県
桜木,千葉県,千葉市若葉区桜木町３３５-４,千葉都市モノレール,千葉都市モノレール２号線,千葉県|静岡県
小倉台,千葉県,千葉市若葉区小倉台４-１７３１-１,千葉都市モノレール,千葉都市モノレール２号線,千葉県
千城台北,千葉県,千葉市若葉区千城台北１-２-２,千葉都市モノレール,千葉都市モノレール２号線,千葉県
千城台,千葉県,千葉市若葉区千城台北３-１-４１８,千葉都市モノレール,千葉都市モノレール２号線,千葉県
小金城趾,千葉県,松戸市大金平４-２１２-２,流鉄,流鉄流山線,千葉県
鰭ヶ崎,千葉県,千葉県流山市大字鰭ケ崎字宮ノ後1438番地3,流鉄,流鉄流山線,千葉県
平和台,千葉県,流山市流山４-４８３,流鉄,流鉄流山線,千葉県|東京都
流山,千葉県,流山市流山１-２６４,流鉄,流鉄流山線,千葉県
松が谷,東京都,八王子市松が谷４０,多摩都市モノレール,多摩モノレール,東京都
大塚・帝京大学,東京都,八王子市大塚１４７３,多摩都市モノレール,多摩モノレール,東京都
中央大学・明星大学,東京都,八王子市東中野７４２,多摩都市モノレール,多摩モノレール,東京都
程久保,東京都,日野市程久保８-１,多摩都市モノレール,多摩モノレール,東京都
万願寺,東京都,日野市新井１２４,多摩都市モノレール,多摩モノレール,東京都
甲州街道,東京都,日野市日野１０３０,多摩都市モノレール,多摩モノレール,東京都
柴崎体育館,東京都,立川市柴崎町６-１０７,多摩都市モノレール,多摩モノレール,東京都
立川南,東京都,立川市柴崎町３-７,多摩都市モノレール,多摩モノレール,東京都
立川北,東京都,立川市曙町２-４,多摩都市モノレール,多摩モノレール,東京都
高松,東京都,立川市高松町１-１００,多摩都市モノレール,多摩モノレール,東京都|石川県|香川県
立飛,東京都,立川市泉町９３５,多摩都市モノレール,多摩モノレール,東京都
泉体育館,東京都,立川市泉町８４１,多摩都市モノレール,多摩モノレール,東京都
砂川七番,東京都,立川市幸町５-１,多摩都市モノレール,多摩モノレール,東京都
桜街道,東京都,東大和市上北台３-４７０,多摩都市モノレール,多摩モノレール,東京都
上北台,東京都,東大和市上北台１-７４２,多摩都市モノレール,多摩モノレール,東京都
仲ノ町,千葉県,銚子市新生町２-２９７,銚子電気鉄道,銚子電鉄線,千葉県
観音,千葉県,銚子市前宿町３６-１,銚子電気鉄道,銚子電鉄線,千葉県
本銚子,千葉県,銚子市清水町２９１７,銚子電気鉄道,銚子電鉄線,千葉県
笠上黒生,千葉県,銚子市笠上町６０１５,銚子電気鉄道,銚子電鉄線,千葉県
西海鹿島,千葉県,銚子市海鹿島町５２１２,銚子電気鉄道,銚子電鉄線,千葉県
海鹿島,千葉県,銚子市小畑新町８５０５-１,銚子電気鉄道,銚子電鉄線,千葉県
君ヶ浜,千葉県,千葉県銚子市君ケ浜8987-4,銚子電気鉄道,銚子電鉄線,千葉県
犬吠,千葉県,銚子市犬吠埼町９５９５-１,銚子電気鉄道,銚子電鉄線,千葉県
外川,千葉県,銚子市外川町２-１０６３６,銚子電気鉄道,銚子電鉄線,千葉県
天王洲アイル,東京都,品川区東品川２-５-１９,東京モノレール・東京臨海高速鉄道,東京モノレール・りんかい線,東京都
大井競馬場前,東京都,品川区勝島２-２-３５,東京モノレール,東京モノレール,東京都
流通センター,東京都,大田区平和島６-１-２,東京モノレール,東京モノレール,東京都
昭和島,東京都,大田区昭和島２-２-１,東京モノレール,東京モノレール,東京都
整備場,東京都,大田区羽田空港１-７-４,東京モノレール,東京モノレール,東京都
新整備場,東京都,大田区羽田空港３-５-１,東京モノレール,東京モノレール,東京都
東雲,東京都,江東区東雲２-８-１０,東京臨海高速鉄道,りんかい線,京都府|東京都
国際展示場,東京都,江東区有明２-５-２５,東京臨海高速鉄道,りんかい線,東京都
東京テレポート,東京都,江東区青海１-２,東京臨海高速鉄道,りんかい線,東京都
品川シーサイド,東京都,品川区東品川４-１２-２２,東京臨海高速鉄道,りんかい線,東京都
東海神,千葉県,船橋市海神２-１５地下１号,東葉高速鉄道,東葉高速線,千葉県
飯山満,千葉県,船橋市飯山満町３-１０５３-５,東葉高速鉄道,東葉高速線,千葉県
船橋日大前,千葉県,船橋市坪井町６８１-３,東葉高速鉄道,東葉高速線,千葉県
八千代緑が丘,千葉県,八千代市緑が丘１-１１０４-３,東葉高速鉄道,東葉高速線,千葉県
八千代中央,千葉県,八千代市ゆりのき台１-３８,東葉高速鉄道,東葉高速線,千葉県
村上,千葉県,八千代市村上字辺田前４０８９-２,東葉高速鉄道,東葉高速線,千葉県|新潟県
箱根板橋,神奈川県,小田原市板橋字薮田１５０-２,箱根登山鉄道,箱根登山鉄道鉄道線,神奈川県
風祭,神奈川県,小田原市風祭字中瀬２４０-２,箱根登山鉄道,箱根登山鉄道鉄道線,神奈川県
入生田,神奈川県,小田原市入生田字松葉１９０-４,箱根登山鉄道,箱根登山鉄道鉄道線,神奈川県
箱根湯本,神奈川県,足柄下郡箱根町湯本白石下７０７-１,箱根登山鉄道,箱根登山鉄道鉄道線,神奈川県
塔ノ沢,神奈川県,足柄下郡箱根町塔之澤恵ケ平４６-２,箱根登山鉄道,箱根登山鉄道鉄道線,神奈川県
大平台,神奈川県,足柄下郡箱根町大平台大向３５５,箱根登山鉄道,箱根登山鉄道鉄道線,神奈川県
宮ノ下,神奈川県,足柄下郡箱根町宮ノ下字蛇骨４０４-１１,箱根登山鉄道,箱根登山鉄道鉄道線,神奈川県
小涌谷,神奈川県,足柄下郡箱根町小涌谷字四面塔４６６-６,箱根登山鉄道,箱根登山鉄道鉄道線,神奈川県
彫刻の森,神奈川県,足柄下郡箱根町二ノ平字北畑１２０４-６,箱根登山鉄道,箱根登山鉄道鉄道線,神奈川県
強羅,神奈川県,足柄下郡箱根町強羅１３００-３２９,箱根登山鉄道,箱根登山鉄道鉄道線・箱根登山ケーブルカー,神奈川県
新柴又,東京都,葛飾区柴又５-７-１,北総鉄道,北総鉄道北総線,東京都
矢切,千葉県,松戸市下矢切字入山津１２０,北総鉄道,北総鉄道北総線,千葉県
北国分,千葉県,市川市堀之内３-２１-１,北総鉄道,北総鉄道北総線,千葉県
秋山,千葉県,松戸市秋山字前原１１２,北総鉄道,北総鉄道北総線,千葉県
松飛台,千葉県,松戸市紙敷１-２９-５,北総鉄道,北総鉄道北総線,千葉県
大町,千葉県,市川市大町１７５,北総鉄道,北総鉄道北総線,佐賀県|北海道|千葉県|富山県|広島県|香川県
西白井,千葉県,白井市根字清水口１０５９-２,北総鉄道,北総鉄道北総線,千葉県
白井,千葉県,白井市復字根木山６２０,北総鉄道,北総鉄道北総線,千葉県
小室,千葉県,船橋市小室町３１０６,北総鉄道,北総鉄道北総線,千葉県
印西牧の原,千葉県,印西市草深２１９１,北総鉄道,北総鉄道北総線,千葉県
龍王峡,栃木県,日光市藤原字イの原,野岩鉄道,ほっとスパ・ライン,栃木県
川治温泉,栃木県,日光市藤原字小網,野岩鉄道,ほっとスパ・ライン,栃木県
川治湯元,栃木県,日光市川治温泉川治字コケイト,野岩鉄道,ほっとスパ・ライン,栃木県
湯西川温泉,栃木県,日光市西川字葛老,野岩鉄道,ほっとスパ・ライン,栃木県
中三依温泉,栃木県,日光市中三依字君山樺地,野岩鉄道,ほっとスパ・ライン,栃木県
上三依塩原温泉口,栃木県,日光市上三依字田代山８０４,野岩鉄道,ほっとスパ・ライン,栃木県
男鹿高原,栃木県,日光市横川字越路,野岩鉄道,ほっとスパ・ライン,栃木県
赤土小学校前,東京都,荒川区東尾久４-７-７,東京都交通局,日暮里・舎人ライナー,東京都
足立小台,東京都,足立区小台１-２０-１,東京都交通局,日暮里・舎人ライナー,東京都
扇大橋,東京都,足立区扇２-２５-７,東京都交通局,日暮里・舎人ライナー,東京都
高野,東京都,足立区扇２-４５-１,東京都交通局,日暮里・舎人ライナー,岡山県|東京都
江北,東京都,足立区江北４-３０-２７,東京都交通局,日暮里・舎人ライナー,東京都
西新井大師西,東京都,足立区江北６-３０-２３,東京都交通局,日暮里・舎人ライナー,東京都
谷在家,東京都,足立区谷在家３-２０-２３,東京都交通局,日暮里・舎人ライナー,東京都
舎人公園,東京都,足立区舎人公園１-１０,東京都交通局,日暮里・舎人ライナー,東京都
舎人,東京都,足立区舎人１-１６-１５,東京都交通局,日暮里・舎人ライナー,東京都
見沼代親水公園,東京都,足立区舎人２-２１-１３,東京都交通局,日暮里・舎人ライナー,東京都
川和町,神奈川県,横浜市都筑区川和町１２５１番地先,横浜市交通局,グリーンライン,神奈川県
都筑ふれあいの丘,神奈川県,横浜市都筑区葛が谷１１番,横浜市交通局,グリーンライン,神奈川県
北山田,神奈川県,横浜市都筑区北山田１丁目６番先,横浜市交通局,グリーンライン,大分県|神奈川県
東山田,神奈川県,横浜市都筑区東山田町３３９番地,横浜市交通局,グリーンライン,神奈川県
高田,神奈川県,横浜市港北区高田東３丁目１番先,横浜市交通局,グリーンライン,奈良県|新潟県|神奈川県|福岡県|長崎県|香川県
日吉本町,神奈川県,横浜市港北区日吉本町５丁目３番,横浜市交通局,グリーンライン,神奈川県
公園下,神奈川県,神奈川県足柄下郡箱根町,箱根登山鉄道,箱根登山ケーブルカー,神奈川県
公園上,神奈川県,神奈川県足柄下郡箱根町,箱根登山鉄道,箱根登山ケーブルカー,神奈川県
中強羅,神奈川県,神奈川県足柄下郡箱根町,箱根登山鉄道,箱根登山ケーブルカー,神奈川県
上強羅,神奈川県,神奈川県足柄下郡箱根町,箱根登山鉄道,箱根登山ケーブルカー,神奈川県
早雲山,神奈川県,神奈川県足柄下郡箱根町強羅,箱根登山鉄道,箱根登山ケーブルカー,神奈川県
上大月,山梨県,大月市大月２丁目,富士急行,富士急行線,山梨県
田野倉,山梨県,都留市田野倉,富士急行,富士急行線,山梨県
禾生,山梨県,都留市古川渡,富士急行,富士急行線,山梨県
赤坂,山梨県,都留市四日市場,富士急行,富士急行線,山梨県|東京都|福岡県|群馬県
都留市,山梨県,都留市つる１-１２-１,富士急行,富士急行線,山梨県
谷村町,山梨県,都留市上谷１丁目,富士急行,富士急行線,山梨県
都留文科大学前,山梨県,都留市田原２-６５４,富士急行,富士急行線,山梨県
十日市場,山梨県,都留市十日市場,富士急行,富士急行線,山梨県|神奈川県
東桂,山梨県,都留市桂町,富士急行,富士急行線,山梨県
三つ峠,山梨県,南都留郡西桂町小沼,富士急行,富士急行線,山梨県
寿,山梨県,富士吉田市上暮地,富士急行,富士急行線,山梨県
葭池温泉前,山梨県,富士吉田市下吉田,富士急行,富士急行線,山梨県
下吉田,山梨県,富士吉田市新倉,富士急行,富士急行線,山梨県
月江寺,山梨県,富士吉田市緑ケ丘１丁目,富士急行,富士急行線,山梨県
富士山,山梨県,富士吉田市松山,富士急行,富士急行線,山梨県
富士急ハイランド,山梨県,南都留郡富士河口湖町船津字剣丸尾,富士急行,富士急行線,山梨県
河口湖,山梨県,南都留郡富士河口湖町船津,富士急行,富士急行線,山梨県
魚沼丘陵,新潟県,南魚沼市野田,北越急行,北越急行ほくほく線,新潟県
美佐島,新潟県,十日町市猿倉,北越急行,北越急行ほくほく線,新潟県
しんざ,新潟県,十日町市新座,北越急行,北越急行ほくほく線,新潟県
まつだい,新潟県,十日町市松代,北越急行,北越急行ほくほく線,新潟県
ほくほく大島,新潟県,上越市大島区下達,北越急行,北越急行ほくほく線,新潟県
虫川大杉,新潟県,上越市浦川原区虫川,北越急行,北越急行ほくほく線,新潟県
うらがわら,新潟県,上越市浦川原区顕聖寺,北越急行,北越急行ほくほく線,新潟県
大池いこいの森,新潟県,上越市頸城区大蒲生田,北越急行,北越急行ほくほく線,新潟県
くびき,新潟県,上越市頸城区手島,北越急行,北越急行ほくほく線,新潟県
軽井沢,長野県,北佐久郡軽井沢町大字軽井沢１１７８番地,しなの鉄道,しなの鉄道線,長野県
中軽井沢,長野県,北佐久郡軽井沢町長倉３０９１番地,しなの鉄道,しなの鉄道線,長野県
信濃追分,長野県,北佐久郡軽井沢町追分１０９２番地,しなの鉄道,しなの鉄道線,長野県
御代田,長野県,北佐久郡御代田町大字御代田２４２２番地,しなの鉄道,しなの鉄道線,長野県
平原,長野県,小諸市大字平原６０３番地,しなの鉄道,しなの鉄道線,長野県
滋野,長野県,東御市滋野乙９７７番地,しなの鉄道,しなの鉄道線,長野県
田中,長野県,東御市田中２７９番地,しなの鉄道,しなの鉄道線,長野県
大屋,長野県,上田市大字大屋４５４番地,しなの鉄道,しなの鉄道線,長野県
信濃国分寺,長野県,上田市大字国分字浦沖１２４６番地の５,しなの鉄道,しなの鉄道線,長野県
上田,長野県,上田市天神１丁目１８８７番地,しなの鉄道・上田交通,しなの鉄道線・上田電鉄別所線,長野県
西上田,長野県,上田市下塩尻屋敷３４１番地,しなの鉄道,しなの鉄道線,長野県
テクノさかき,長野県,埴科郡坂城町大字南条字社宮神４９１０-５番地,しなの鉄道,しなの鉄道線,長野県
坂城,長野県,埴科郡坂城町坂城,しなの鉄道,しなの鉄道線,長野県
戸倉,長野県,千曲市大字戸倉１４４５番地,しなの鉄道,しなの鉄道線,長野県
千曲,長野県,長野県千曲市大字寂蒔200,しなの鉄道,しなの鉄道線,長野県
屋代,長野県,千曲市大字小島３１３９番地,しなの鉄道,しなの鉄道線,長野県
屋代高校前,長野県,千曲市大字屋代字新田１４１１の３番地,しなの鉄道,しなの鉄道線,長野県
城下,長野県,上田市大字諏訪形字中田９８２,上田交通,上田電鉄別所線,岡山県|長野県
三好町,長野県,上田市大字中之条字中満丁２４０-５,上田交通,上田電鉄別所線,長野県
赤坂上,長野県,上田市大字上田原字一ノ口８７５-７,上田交通,上田電鉄別所線,長野県
上田原,長野県,上田市大字上田原字屋鋪田６９７-５,上田交通,上田電鉄別所線,長野県
寺下,長野県,上田市大字神畑字寺下６１６-１,上田交通,上田電鉄別所線,長野県
神畑,長野県,上田市大字神畑字孤池９４-５,上田交通,上田電鉄別所線,長野県
大学前,長野県,上田市大字下之郷字上迎２８４-５,上田交通,上田電鉄別所線,滋賀県|長野県
下之郷,長野県,上田市大字下之郷５１７-３,上田交通,上田電鉄別所線,長野県
中塩田,長野県,上田市大字五加字富在家１２２５-６,上田交通,上田電鉄別所線,長野県
塩田町,長野県,上田市大字中野字兼田４０-２,上田交通,上田電鉄別所線,長野県
中野,長野県,上田市大字中野字池下４９６-４,上田交通,上田電鉄別所線,東京都|群馬県|長野県
舞田,長野県,上田市大字舞田字柳堂４４-６,上田交通,上田電鉄別所線,長野県
八木沢,長野県,上田市大字八木沢字表田中４３９-２,上田交通,上田電鉄別所線,長野県
別所温泉,長野県,上田市大字別所温泉１８５３-３,上田交通,上田電鉄別所線,長野県
市役所前,長野県,長野市鶴賀字森下１１２０-５,長野電鉄,長野電鉄長野線,北海道|千葉県|和歌山県|広島県|愛媛県|愛知県|長野県|鹿児島県
権堂,長野県,長野市権堂町２１９９-１０,長野電鉄,長野電鉄長野線,長野県
善光寺下,長野県,長野市三輪７-９１９-２,長野電鉄,長野電鉄長野線,長野県
本郷,長野県,長野市三輪３-１５-９,長野電鉄,長野電鉄長野線,広島県|愛知県|福岡県|長野県
桐原,長野県,長野市古野宮西８２８-２,長野電鉄,長野電鉄長野線,新潟県|長野県
信濃吉田,長野県,長野市吉田３-９-１３,長野電鉄,長野電鉄長野線,長野県
朝陽,長野県,長野市南堀村北１９２-１,長野電鉄,長野電鉄長野線,長野県
附属中学前,長野県,長野市南堀中堰北８３-１,長野電鉄,長野電鉄長野線,長野県
柳原,長野県,長野市柳原西井２１３３-２,長野電鉄,長野電鉄長野線,岩手県|愛媛県|長野県
村山,長野県,須坂市高梨町流３０３-２,長野電鉄,長野電鉄長野線,山形県|長野県
日野,長野県,須坂市小山蒔田２５１７-１５,長野電鉄,長野電鉄長野線,東京都|滋賀県|長野県
須坂,長野県,須坂市須坂宗石１２８８-２,長野電鉄,長野電鉄長野線,長野県
北須坂,長野県,須坂市小河原町北山道北沖２１２９-４,長野電鉄,長野電鉄長野線,長野県
小布施,長野県,上高井郡小布施町小布施親木１４９７-２,長野電鉄,長野電鉄長野線,長野県
都住,長野県,上高井郡小布施町都住宮上４７２-４,長野電鉄,長野電鉄長野線,長野県
桜沢,長野県,中野市三ツ和大日前１４９７-１,長野電鉄,長野電鉄長野線,埼玉県|長野県
延徳,長野県,中野市篠井堰向２２９-２,長野電鉄,長野電鉄長野線,長野県
信州中野,長野県,中野市西１-１,長野電鉄,長野電鉄長野線,長野県
中野松川,長野県,中野市中野馬場１８４０-３,長野電鉄,長野電鉄長野線,長野県
信濃竹原,長野県,中野市竹原松崎１８１３,長野電鉄,長野電鉄長野線,長野県
夜間瀬,長野県,下高井郡山ノ内町夜間瀬下田中島２４９３-２,長野電鉄,長野電鉄長野線,長野県
上条,長野県,下高井郡山ノ内町平穏仁堂下４５９４-２,長野電鉄,長野電鉄長野線,新潟県|長野県
湯田中,長野県,下高井郡山ノ内町平穏字下中道南,長野電鉄,長野電鉄長野線,長野県
西松本,長野県,松本市中条３-１５,アルピコ交通,上高地線,長野県
渚,長野県,松本市渚３-９-４２,アルピコ交通,上高地線,岐阜県|長野県
信濃荒井,長野県,松本市大字島立字荒井５５,アルピコ交通,上高地線,長野県
大庭,長野県,松本市大字島立字大庭１８６８,アルピコ交通,上高地線,長野県
下新,長野県,松本市大字新村下新北３２８７,アルピコ交通,上高地線,長野県
北新・松本大学前,長野県,松本市大字新村北新西２０８８,アルピコ交通,上高地線,長野県
新村,長野県,松本市大字新村山王５４８,アルピコ交通,上高地線,長野県
三溝,長野県,長野県松本市波田三溝1680-2,アルピコ交通,上高地線,長野県
森口,長野県,長野県松本市波田森口4417-25,アルピコ交通,上高地線,長野県
下島,長野県,長野県松本市波田4417-12,アルピコ交通,上高地線,長野県
波田,長野県,長野県松本市波田鍋割4417-28,アルピコ交通,上高地線,長野県
渕東,長野県,長野県松本市波田4207,アルピコ交通,上高地線,長野県
新島々,長野県,長野県松本市波田赤松3050-1,アルピコ交通,上高地線,長野県
