name,pref,address,companies,lines,exclude
梅ヶ丘,東京都,東京都世田谷区梅丘,小田急電鉄,小田急線,東京都
豪徳寺,東京都,世田谷区豪徳寺１丁目,小田急電鉄・東急電鉄,小田急線・東急世田谷線,東京都
経堂,東京都,世田谷区経堂１丁目,小田急電鉄,小田急線,東京都
千歳船橋,東京都,世田谷区船橋１丁目,小田急電鉄,小田急線,東京都
祖師ヶ谷大蔵,東京都,東京都世田谷区祖師谷1丁目,小田急電鉄,小田急線,東京都
成城学園前,東京都,世田谷区成城６丁目,小田急電鉄,小田急線,東京都
喜多見,東京都,世田谷区喜多見９丁目,小田急電鉄,小田急線,東京都
狛江,東京都,狛江市東和泉１丁目,小田急電鉄,小田急線,東京都
和泉多摩川,東京都,狛江市東和泉４丁目,小田急電鉄,小田急線,東京都
向ヶ丘遊園,神奈川県,神奈川県川崎市多摩区登戸,小田急電鉄,小田急線,神奈川県
生田,神奈川県,川崎市多摩区生田７丁目,小田急電鉄,小田急線,神奈川県|秋田県
読売ランド前,神奈川県,川崎市多摩区西生田,小田急電鉄,小田急線,神奈川県
百合ヶ丘,神奈川県,川崎市麻生区百合丘一丁目21番1号,小田急電鉄,小田急線,神奈川県
新百合ヶ丘,神奈川県,川崎市麻生区万福寺一丁目18番1号,小田急電鉄,小田急線・小田急多摩線,神奈川県
柿生,神奈川県,川崎市麻生区上麻生,小田急電鉄,小田急線,神奈川県
鶴川,東京都,町田市能ケ谷町,小田急電鉄,小田急線,東京都
玉川学園前,東京都,町田市玉川学園２丁目,小田急電鉄,小田急線,東京都
相模大野,神奈川県,相模原市南区相模大野三丁目8番1号,小田急電鉄,小田急線・小田急江ノ島線,神奈川県
小田急相模原,神奈川県,相模原市南区南台三丁目20番1号,小田急電鉄,小田急線,神奈川県
相武台前,神奈川県,神奈川県座間市相武台一丁目33番1号,小田急電鉄,小田急線,神奈川県
座間,神奈川県,神奈川県座間市入谷東三丁目60番1号,小田急電鉄,小田急線,神奈川県
本厚木,神奈川県,厚木市泉町１丁目,小田急電鉄,小田急線,神奈川県
愛甲石田,神奈川県,厚木市愛甲,小田急電鉄,小田急線,神奈川県
伊勢原,神奈川県,伊勢原市桜台１丁目,小田急電鉄,小田急線,神奈川県
鶴巻温泉,神奈川県,秦野市鶴巻北２丁目,小田急電鉄,小田急線,神奈川県
東海大学前,神奈川県,秦野市北矢名,小田急電鉄,小田急線,神奈川県
秦野,神奈川県,秦野市大秦町１丁目,小田急電鉄,小田急線,神奈川県
渋沢,神奈川県,秦野市曲松１丁目,小田急電鉄,小田急線,神奈川県
新松田,神奈川県,足柄上郡松田町松田惣領,小田急電鉄,小田急線,神奈川県
開成,神奈川県,足柄上郡開成町吉田島字中河原,小田急電鉄,小田急線,神奈川県
栢山,神奈川県,小田原市栢山,小田急電鉄,小田急線,神奈川県
富水,神奈川県,小田原市堀之内,小田急電鉄,小田急線,神奈川県
螢田,神奈川県,小田原市蓮正寺,小田急電鉄,小田急線,神奈川県
足柄,神奈川県,小田原市扇町３丁目,小田急電鉄,小田急線,神奈川県|静岡県
東林間,神奈川県,相模原市南区上鶴間七丁目7番1号,小田急電鉄,小田急江ノ島線,神奈川県
中央林間,神奈川県,大和市中央林間３-３-８,小田急電鉄・東急電鉄,小田急江ノ島線・東急田園都市線,神奈川県
南林間,神奈川県,大和市南林間１-６-１１,小田急電鉄,小田急江ノ島線,神奈川県
鶴間,神奈川県,大和市西鶴間１-１-１,小田急電鉄,小田急江ノ島線,神奈川県
大和,神奈川県,大和市大和南１-１-１,小田急電鉄・相模鉄道,小田急江ノ島線・相鉄本線,神奈川県|茨城県
桜ヶ丘,神奈川県,神奈川県大和市福田,小田急電鉄,小田急江ノ島線,神奈川県
高座渋谷,神奈川県,大和市福田２０１９,小田急電鉄,小田急江ノ島線,神奈川県
長後,神奈川県,藤沢市下土棚４７２,小田急電鉄,小田急江ノ島線,神奈川県
湘南台,神奈川県,藤沢市湘南台２-１５,小田急電鉄・相模鉄道・横浜市交通局,小田急江ノ島線・相鉄いずみ野線・ブルーライン,神奈川県
六会日大前,神奈川県,藤沢市亀井野１-１-１,小田急電鉄,小田急江ノ島線,神奈川県
善行,神奈川県,藤沢市善行１-２７,小田急電鉄,小田急江ノ島線,神奈川県
藤沢本町,神奈川県,藤沢市藤沢３-３-４,小田急電鉄,小田急江ノ島線,神奈川県
本鵠沼,神奈川県,藤沢市本鵠沼２-１３-１４,小田急電鉄,小田急江ノ島線,神奈川県
鵠沼海岸,神奈川県,藤沢市鵠沼海岸２-４-１０,小田急電鉄,小田急江ノ島線,神奈川県
片瀬江ノ島,神奈川県,藤沢市片瀬海岸２-１５-３,小田急電鉄,小田急江ノ島線,神奈川県
五月台,神奈川県,川崎市麻生区五力田３丁目,小田急電鉄,小田急多摩線,神奈川県
栗平,神奈川県,川崎市麻生区栗平２-１-１,小田急電鉄,小田急多摩線,神奈川県
黒川,神奈川県,川崎市麻生区南黒川４丁目,小田急電鉄,小田急多摩線,佐賀県|愛知県|神奈川県|香川県
はるひ野,神奈川県,川崎市麻生区黒川字谷ツ１０２１番１,小田急電鉄,小田急多摩線,神奈川県
唐木田,東京都,多摩市落合,小田急電鉄,小田急多摩線,東京都
代官山,東京都,渋谷区代官山町１９-４,東急電鉄,東急東横線,東京都
中目黒,東京都,目黒区上目黒３-４-１,東急電鉄・東京メトロ,東急東横線・東京メトロ日比谷線,東京都
祐天寺,東京都,目黒区祐天寺２-１３-３,東急電鉄,東急東横線,東京都
学芸大学,東京都,目黒区鷹番３-２-１,東急電鉄,東急東横線,東京都
都立大学,東京都,目黒区中根１-５-１,東急電鉄,東急東横線,東京都
自由が丘,東京都,目黒区自由が丘１-３０-１,東急電鉄,東急東横線・東急大井町線,東京都
田園調布,東京都,大田区田園調布３-２５-１８,東急電鉄,東急東横線・東急目黒線,東京都
多摩川,東京都,大田区田園調布１-５３-８,東急電鉄,東急東横線・東急目黒線・東急多摩川線,東京都
新丸子,神奈川県,川崎市中原区新丸子町７６６,東急電鉄,東急東横線・東急目黒線,神奈川県
元住吉,神奈川県,川崎市中原区木月６７９,東急電鉄,東急東横線・東急目黒線,神奈川県
日吉,神奈川県,横浜市港北区日吉２-１-１,東急電鉄・横浜市交通局,東急東横線・東急目黒線・グリーンライン,京都府|神奈川県
綱島,神奈川県,横浜市港北区綱島西１-１-８,東急電鉄,東急東横線,神奈川県
大倉山,神奈川県,横浜市港北区大倉山一丁目1-1,東急電鉄,東急東横線,兵庫県|神奈川県
妙蓮寺,神奈川県,横浜市港北区菊名１-１-１,東急電鉄,東急東横線,神奈川県
白楽,神奈川県,横浜市神奈川区白楽１００,東急電鉄,東急東横線,神奈川県
東白楽,神奈川県,横浜市神奈川区白楽１２-１,東急電鉄,東急東横線,神奈川県
反町,神奈川県,横浜市神奈川区反町１-１,東急電鉄,東急東横線,神奈川県
不動前,東京都,品川区西五反田５-１２-１,東急電鉄,東急目黒線,東京都
武蔵小山,東京都,品川区小山３-４-８,東急電鉄,東急目黒線,東京都
西小山,東京都,品川区小山６-３-１０,東急電鉄,東急目黒線,東京都
洗足,東京都,目黒区洗足２-２１-１,東急電鉄,東急目黒線,東京都
大岡山,東京都,大田区北千束３-２７-１,東急電鉄,東急目黒線・東急大井町線,東京都
奥沢,東京都,世田谷区奥沢３-４７-１７,東急電鉄,東急目黒線,東京都
池尻大橋,東京都,世田谷区池尻３-２,東急電鉄,東急田園都市線,東京都
三軒茶屋,東京都,世田谷区太子堂４-２１-１,東急電鉄,東急田園都市線・東急世田谷線,東京都
駒沢大学,東京都,世田谷区上馬４-３,東急電鉄,東急田園都市線,東京都
桜新町,東京都,世田谷区桜新町２-８,東急電鉄,東急田園都市線,東京都
用賀,東京都,世田谷区用賀２-３９,東急電鉄,東急田園都市線,東京都
二子玉川,東京都,世田谷区玉川２-２２-１３,東急電鉄,東急田園都市線・東急大井町線,東京都
二子新地,神奈川県,川崎市高津区二子２-２-１,東急電鉄,東急田園都市線・東急大井町線,神奈川県
高津,神奈川県,川崎市高津区二子４-１-１,東急電鉄,東急田園都市線・東急大井町線,京都府|神奈川県
梶が谷,神奈川県,川崎市高津区末長字姿見台８５,東急電鉄,東急田園都市線,神奈川県
宮崎台,神奈川県,川崎市宮前区宮崎２-１０-１２,東急電鉄,東急田園都市線,神奈川県
宮前平,神奈川県,川崎市宮前区宮前１-１１-１,東急電鉄,東急田園都市線,神奈川県
鷺沼,神奈川県,川崎市宮前区鷺沼３-１-１,東急電鉄,東急田園都市線,神奈川県
たまプラーザ,神奈川県,横浜市青葉区美しが丘１-３,東急電鉄,東急田園都市線,神奈川県
あざみ野,神奈川県,横浜市青葉区あざみ野２-１-１,東急電鉄・横浜市交通局,東急田園都市線・ブルーライン,神奈川県
江田,神奈川県,横浜市青葉区荏田町２３６０,東急電鉄,東急田園都市線,神奈川県|福島県
市が尾,神奈川県,横浜市青葉区市ケ尾町１１５６-１,東急電鉄,東急田園都市線,神奈川県
藤が丘,神奈川県,横浜市青葉区藤が丘２-５-４,東急電鉄,東急田園都市線,愛知県|神奈川県
青葉台,神奈川県,横浜市青葉区青葉台１-７-３,東急電鉄,東急田園都市線,神奈川県
田奈,神奈川県,横浜市青葉区田奈町３９８７,東急電鉄,東急田園都市線,神奈川県
つくし野,東京都,町田市つくし野４-１,東急電鉄,東急田園都市線,東京都
すずかけ台,東京都,町田市つくし野３-１,東急電鉄,東急田園都市線,東京都
南町田グランベリーパーク,東京都,町田市鶴間３-３-２,東急電鉄,東急田園都市線,東京都
つきみ野,神奈川県,大和市つきみ野５-８-１,東急電鉄,東急田園都市線,神奈川県
下神明,東京都,品川区西品川１-２９-６,東急電鉄,東急大井町線,東京都
戸越公園,東京都,品川区戸越５-１０-１５,東急電鉄,東急大井町線,東京都
中延,東京都,品川区中延４-５-５,東急電鉄・東京都交通局,東急大井町線・都営浅草線,東京都
荏原町,東京都,品川区中延５-２-１,東急電鉄,東急大井町線,東京都
旗の台,東京都,品川区旗の台２-１３-１,東急電鉄,東急大井町線・東急池上線,東京都
北千束,東京都,大田区北千束２-１６-１,東急電鉄,東急大井町線,東京都
緑が丘,東京都,目黒区緑が丘３-１-１２,東急電鉄,東急大井町線,兵庫県|北海道|東京都
九品仏,東京都,世田谷区奥沢７-２０-１,東急電鉄,東急大井町線,東京都
尾山台,東京都,世田谷区等々力５-５-７,東急電鉄,東急大井町線,東京都
等々力,東京都,世田谷区等々力３-１-１,東急電鉄,東急大井町線,東京都
上野毛,東京都,世田谷区上野毛１-２６-６,東急電鉄,東急大井町線,東京都
大崎広小路,東京都,品川区大崎４-１-１,東急電鉄,東急池上線,東京都
戸越銀座,東京都,品川区平塚２-１６-１,東急電鉄・東京都交通局,東急池上線・都営浅草線,東京都
荏原中延,東京都,品川区中延２-８-１,東急電鉄,東急池上線,東京都
長原,東京都,大田区上池台１-１０-１０,東急電鉄,東急池上線,大阪府|東京都
洗足池,東京都,大田区東雪谷１-１-６,東急電鉄,東急池上線,東京都
石川台,東京都,大田区東雪谷２-２３-１,東急電鉄,東急池上線,東京都
雪が谷大塚,東京都,大田区南雪谷２-２-１６,東急電鉄,東急池上線,東京都
御嶽山,東京都,大田区北嶺町３２-１７,東急電鉄,東急池上線,東京都
久が原,東京都,大田区南久が原２-６-１０,東急電鉄,東急池上線,東京都
千鳥町,東京都,大田区千鳥１-２０-１,東急電鉄,東急池上線,東京都
池上,東京都,大田区池上６-３-１０,東急電鉄,東急池上線,東京都
蓮沼,東京都,大田区西蒲田７-１７-１,東急電鉄,東急池上線,東京都
沼部,東京都,大田区田園調布本町２８-１,東急電鉄,東急多摩川線,東京都
鵜の木,東京都,大田区鵜の木２-４-１,東急電鉄,東急多摩川線,東京都
下丸子,東京都,大田区下丸子３-７-１,東急電鉄,東急多摩川線,東京都
武蔵新田,東京都,大田区矢口１-１８-１,東急電鉄,東急多摩川線,東京都
矢口渡,東京都,大田区多摩川１-２０-１５,東急電鉄,東急多摩川線,東京都
西太子堂,東京都,世田谷区太子堂４-１０-３,東急電鉄,東急世田谷線,東京都
若林,東京都,世田谷区若林４-３-１５,東急電鉄,東急世田谷線,愛知県|東京都
松陰神社前,東京都,世田谷区若林４-２１-１６,東急電鉄,東急世田谷線,東京都
世田谷,東京都,世田谷区世田谷４-９-６,東急電鉄,東急世田谷線,東京都
上町,東京都,世田谷区世田谷３-４-３,東急電鉄,東急世田谷線,東京都
宮の坂,東京都,世田谷区宮坂１-２４-７,東急電鉄,東急世田谷線,東京都
松原,東京都,世田谷区松原４-１０-８,東急電鉄,東急世田谷線,東京都|長崎県
恩田,神奈川県,横浜市青葉区恩田町２０４３,東急電鉄,東急こどもの国線,神奈川県
こどもの国,神奈川県,横浜市青葉区奈良町宇島９９５-１,東急電鉄,東急こどもの国線,愛知県|神奈川県
泉岳寺,東京都,港区高輪２-１６-３４,京急電鉄・東京都交通局,京急本線・都営浅草線,東京都
北品川,東京都,品川区北品川１-１-４,京急電鉄,京急本線,東京都
新馬場,東京都,品川区北品川２-１８-１,京急電鉄,京急本線,東京都
青物横丁,東京都,品川区南品川３-１-２０,京急電鉄,京急本線,東京都
鮫洲,東京都,品川区東大井１-２-２０,京急電鉄,京急本線,東京都
立会川,東京都,品川区東大井２-２３-１,京急電鉄,京急本線,東京都
大森海岸,東京都,品川区南大井３-３２-１,京急電鉄,京急本線,東京都
平和島,東京都,大田区大森北６-１３-１１,京急電鉄,京急本線,東京都
大森町,東京都,大田区大森西３-２４-７,京急電鉄,京急本線,東京都
梅屋敷,東京都,大田区蒲田２-２８-１,京急電鉄,京急本線,奈良県|東京都
京急蒲田,東京都,大田区蒲田４-５０-１０,京急電鉄,京急本線・京急空港線,東京都
雑色,東京都,大田区仲六郷２-４２-１,京急電鉄,京急本線,東京都
六郷土手,東京都,大田区仲六郷４-２７-１１,京急電鉄,京急本線,東京都
京急川崎,神奈川県,川崎市川崎区砂子１-３-１,京急電鉄,京急本線・京急大師線,神奈川県
鶴見市場,神奈川県,横浜市鶴見区市場大和町７-１,京急電鉄,京急本線,神奈川県
花月総持寺,神奈川県,横浜市鶴見区生麦５-１-３,京急電鉄,京急本線,神奈川県
生麦,神奈川県,横浜市鶴見区生麦３-１-３５,京急電鉄,京急本線,神奈川県
子安,神奈川県,横浜市神奈川区子安通１-４６,京急電鉄,京急本線,神奈川県
神奈川新町,神奈川県,横浜市神奈川区亀住町１９-１,京急電鉄,京急本線,神奈川県
戸部,神奈川県,横浜市西区戸部本町４８-１１,京急電鉄,京急本線,神奈川県
日ノ出町,神奈川県,横浜市中区日ノ出町１-３１,京急電鉄,京急本線,神奈川県
黄金町,神奈川県,横浜市南区白金町１-１,京急電鉄,京急本線,神奈川県
南太田,神奈川県,横浜市南区南太田１-２５-１,京急電鉄,京急本線,神奈川県
井土ヶ谷,神奈川県,横浜市南区井土ケ谷中町,京急電鉄,京急本線,神奈川県
弘明寺,神奈川県,横浜市南区弘明寺町267,京急電鉄,京急本線,神奈川県
上大岡,神奈川県,横浜市港南区上大岡西１-６-１,京急電鉄・横浜市交通局,京急本線・ブルーライン,神奈川県
屏風浦,神奈川県,横浜市磯子区森３-１８-６,京急電鉄,京急本線,神奈川県
杉田,神奈川県,横浜市磯子区杉田２-１-９,京急電鉄,京急本線,神奈川県|福島県
京急富岡,神奈川県,横浜市金沢区富岡西７-１-１,京急電鉄,京急本線,神奈川県
能見台,神奈川県,横浜市金沢区能見台通２-１,京急電鉄,京急本線,神奈川県
金沢文庫,神奈川県,横浜市金沢区谷津町３８４,京急電鉄,京急本線,神奈川県
金沢八景,神奈川県,横浜市金沢区瀬戸１５-１,京急電鉄・株式会社横浜シーサイドライン,京急本線・京急逗子線・金沢シーサイドライン,神奈川県
追浜,神奈川県,横須賀市追浜町３-３,京急電鉄,京急本線,神奈川県
京急田浦,神奈川県,横須賀市船越町５-２,京急電鉄,京急本線,神奈川県
安針塚,神奈川県,横須賀市長浦町２-３２,京急電鉄,京急本線,神奈川県
逸見,神奈川県,横須賀市東逸見町２-１８,京急電鉄,京急本線,神奈川県
汐入,神奈川県,横須賀市汐入町２-４１,京急電鉄,京急本線,神奈川県
横須賀中央,神奈川県,横須賀市若松町２-２５,京急電鉄,京急本線,神奈川県
県立大学,神奈川県,横須賀市安浦町２-２８,京急電鉄,京急本線,神奈川県
堀ノ内,神奈川県,横須賀市三春町３-４５,京急電鉄,京急本線・京急久里浜線,神奈川県
京急大津,神奈川県,横須賀市大津町１-１１-１９,京急電鉄,京急本線,神奈川県
馬堀海岸,神奈川県,横須賀市馬堀町３-２０-１,京急電鉄,京急本線,神奈川県
浦賀,神奈川県,横須賀市浦賀町１-８６,京急電鉄,京急本線,神奈川県
糀谷,東京都,大田区西糀谷４-１３-１７,京急電鉄,京急空港線,東京都
大鳥居,東京都,大田区西糀谷３-３７-１８,京急電鉄,京急空港線,東京都
穴守稲荷,東京都,大田区羽田４-６-１１,京急電鉄,京急空港線,東京都
天空橋,東京都,大田区羽田空港１-１-２,京急電鉄・東京モノレール,京急空港線・東京モノレール,東京都
羽田空港第3ターミナル,東京都,東京都大田区羽田空港二丁目6番5号,京急電鉄・東京モノレール,京急空港線・東京モノレール,東京都
羽田空港第1・第2ターミナル,東京都,大田区羽田空港３-３-４,京急電鉄・東京モノレール,京急空港線・東京モノレール,東京都
港町,神奈川県,川崎市川崎区港町１-１,京急電鉄,京急大師線,神奈川県
鈴木町,神奈川県,川崎市川崎区鈴木町２-２,京急電鉄,京急大師線,神奈川県
川崎大師,神奈川県,川崎市川崎区大師駅前１-１８-１,京急電鉄,京急大師線,神奈川県
東門前,神奈川県,川崎市川崎区中瀬３-２３-１０,京急電鉄,京急大師線,神奈川県
大師橋,神奈川県,川崎市川崎区大師河原２-４-２５,京急電鉄,京急大師線,神奈川県
小島新田,神奈川県,川崎市川崎区田町２-３-１５,京急電鉄,京急大師線,神奈川県
六浦,神奈川県,横浜市金沢区六浦町１５３４,京急電鉄,京急逗子線,神奈川県
神武寺,神奈川県,逗子市池子２-１１-２,京急電鉄,京急逗子線,神奈川県
逗子・葉山,神奈川県,逗子市逗子５-１-６,京急電鉄,京急逗子線,神奈川県
新大津,神奈川県,横須賀市大津町４-７-１,京急電鉄,京急久里浜線,神奈川県
北久里浜,神奈川県,横須賀市根岸町２-２０６,京急電鉄,京急久里浜線,神奈川県
ＹＲＰ野比,神奈川県,横須賀市野比１-９-１,京急電鉄,京急久里浜線,神奈川県
京急長沢,神奈川県,横須賀市長沢１-３５-１,京急電鉄,京急久里浜線,神奈川県
津久井浜,神奈川県,横須賀市津久井４-２-１,京急電鉄,京急久里浜線,神奈川県
三浦海岸,神奈川県,三浦市南下浦町上宮田１４９７,京急電鉄,京急久里浜線,神奈川県
三崎口,神奈川県,三浦市初声町下宮田４９５,京急電鉄,京急久里浜線,神奈川県
田原町,東京都,台東区西浅草１-１-１８,東京メトロ,東京メトロ銀座線,東京都|福井県
稲荷町,東京都,台東区東上野３-３３-１１,東京メトロ,東京メトロ銀座線,富山県|広島県|東京都
末広町,東京都,千代田区外神田４-７-３,東京メトロ,東京メトロ銀座線,北海道|富山県|東京都
日本橋,東京都,中央区日本橋１丁目,東京メトロ・東京都交通局,東京メトロ銀座線・東京メトロ東西線・都営浅草線,東京都
京橋,東京都,中央区京橋２-２-１０,東京メトロ・東京都交通局,東京メトロ銀座線・都営浅草線,大阪府|東京都
銀座,東京都,中央区銀座４-１-２,東京メトロ,東京メトロ銀座線・東京メトロ丸ノ内線・東京メトロ日比谷線・東京メトロ有楽町線,東京都
虎ノ門,東京都,港区虎ノ門１-１-２１,東京メトロ,東京メトロ銀座線・東京メトロ日比谷線,東京都
溜池山王,東京都,千代田区永田町２-１１-１,東京メトロ,東京メトロ銀座線・東京メトロ南北線,東京都
赤坂見附,東京都,港区赤坂３-１-６,東京メトロ,東京メトロ銀座線・東京メトロ丸ノ内線・東京メトロ有楽町線・東京メトロ半蔵門線・東京メトロ南北線,東京都
青山一丁目,東京都,港区南青山１-１-１９,東京メトロ・東京都交通局,東京メトロ銀座線・東京メトロ半蔵門線・都営大江戸線,東京都
外苑前,東京都,港区北青山２-７-１６,東京メトロ,東京メトロ銀座線,東京都
表参道,東京都,港区北青山３丁目,東京メトロ,東京メトロ銀座線・東京メトロ千代田線・東京メトロ半蔵門線,東京都
新大塚,東京都,文京区大塚４-５１-５,東京メトロ,東京メトロ丸ノ内線,東京都
茗荷谷,東京都,文京区小日向４-６-１５,東京メトロ,東京メトロ丸ノ内線,東京都
後楽園,東京都,文京区春日１-２-３,東京メトロ,東京メトロ丸ノ内線・東京メトロ南北線,東京都
本郷三丁目,東京都,文京区本郷２-３９-１,東京メトロ・東京都交通局,東京メトロ丸ノ内線・都営大江戸線,東京都
大手町,東京都,千代田区大手町１丁目,東京メトロ・東京都交通局,東京メトロ丸ノ内線・東京メトロ東西線・東京メトロ千代田線・東京メトロ半蔵門線・都営三田線,愛媛県|東京都
霞ケ関,東京都,千代田区霞が関２丁目,東京メトロ,東京メトロ丸ノ内線・東京メトロ日比谷線・東京メトロ千代田線,東京都
国会議事堂前,東京都,千代田区永田町１丁目,東京メトロ,東京メトロ丸ノ内線・東京メトロ千代田線,東京都
四谷三丁目,東京都,新宿区四谷３-８,東京メトロ,東京メトロ丸ノ内線,東京都
新宿御苑前,東京都,新宿区新宿１-８-１,東京メトロ,東京メトロ丸ノ内線,東京都
新宿三丁目,東京都,新宿区新宿３-１４-１,東京メトロ・東京都交通局,東京メトロ丸ノ内線・東京メトロ副都心線・都営新宿線,東京都
西新宿,東京都,新宿区西新宿６-７-５１,東京メトロ,東京メトロ丸ノ内線,東京都
中野坂上,東京都,中野区中央２-１-２,東京メトロ・東京都交通局,東京メトロ丸ノ内線・都営大江戸線,東京都
新中野,東京都,中野区中央４-２-１５,東京メトロ,東京メトロ丸ノ内線,東京都
東高円寺,東京都,杉並区和田３-５５-４２,東京メトロ,東京メトロ丸ノ内線,東京都
新高円寺,東京都,杉並区高円寺南２-２０-１,東京メトロ,東京メトロ丸ノ内線,東京都
南阿佐ケ谷,東京都,杉並区阿佐谷南１-１５-７,東京メトロ,東京メトロ丸ノ内線,東京都
中野新橋,東京都,中野区弥生町２-２６-８,東京メトロ,東京メトロ丸ノ内線,東京都
中野富士見町,東京都,中野区弥生町５-２４-４,東京メトロ,東京メトロ丸ノ内線,東京都
方南町,東京都,杉並区堀ノ内１-１-１,東京メトロ,東京メトロ丸ノ内線,東京都
三ノ輪,東京都,台東区三ノ輪２-１４-７,東京メトロ,東京メトロ日比谷線,東京都
入谷,東京都,台東区入谷１-６-４,東京メトロ,東京メトロ日比谷線,東京都|神奈川県
